{
  "$schema": "./docs/profile-answers.schema.json",
  "version": 1,
  "identity": {
    "displayName": "你的名字",
    "title": "Developer / Music Explorer",
    "location": "Taiwan",
    "tagline": ["Code", "Music", "Learning"],
    "bio": "喜歡把想法做成小工具，也用音樂記錄生活。"
  },
  "socials": [
    { "service": "github", "url": "https://github.com/yourname" },
    { "service": "email", "url": "mailto:hello@example.com" }
  ],
  "links": [
    {
      "id": "projects",
      "title": "Projects",
      "url": "https://github.com/yourname?tab=repositories",
      "description": "最近完成的工具、練習與實驗。",
      "icon": "code",
      "tags": ["Open source", "Side projects"]
    }
  ],
  "sections": [
    {
      "id": "about",
      "title": "About",
      "description": "目前專注在軟體開發，也持續整理學習筆記。",
      "tags": ["Developer", "Learning"]
    },
    {
      "id": "music",
      "title": "Music",
      "description": "分享最近反覆播放的歌與現場演出紀錄。",
      "tags": ["Playlist", "Live"]
    }
  ],
  "imageBlocks": [
    {
      "id": "featured-story",
      "title": "最近的一段故事",
      "image": "/images/projects.svg",
      "imageAlt": "作品與靈感的幾何示意圖",
      "description": "可在圖片旁邊或下方補充一段文字。",
      "placement": "between-links-sections",
      "imageLayout": "split-left",
      "imageAspect": "landscape",
      "imagePosition": "center",
      "tags": ["Story"]
    }
  ],
  "playlist": null,
  "features": { "fortune": true },
  "appearance": {
    "sectionsLayout": "grid",
    "bodyFont": "noto-sans-tc",
    "displayFont": "noto-serif-tc",
    "homeOrder": ["about", "links", "turntable", "fortune", "notion"]
  }
}
